"tt_id","tt_ten","tt_id_dv","tt_ma","lv_id","dv_id","tt_thoihan_gq","dtth_ten","ctth_ten","kq_ten","tt_sobo_tphs","tt_trinhtu_th","tt_lephi","tt_yeucau_dk","tt_revision","tt_cancu_pl","tt_ghichu","ngaycapnhatcuoi","tt_stt","tt_ngung_sd","qt_id","vbpl_banhanhtt","tt_ten_kd","tt_link_lienket","ctth_id","sd_buuchinh"
"126001","Cho phép thành lập cơ sở giáo dục mầm non, cơ sở giáo dục phổ thông có vốn đầu tư nước ngoài tại Việt Nam","42055","1.000939.000.00.00.H51","2","14","45 ngày","Cá nhân","Thủ tục hành chính công mức độ 4","Quyết định","01","<p> 	Trường hợp cơ sở gi&aacute;o dục c&oacute; vốn đầu tư nước ngo&agrave;i đ&atilde; được cấp Giấy chứng nhận đầu tư đồng thời l&agrave; Giấy chứng nhận đăng k&yacute; kinh doanh v&agrave; Giấy ph&eacute;p hoạt động gi&aacute;o dục trước ng&agrave;y Nghị định số 86/2018/NĐ-CP c&oacute; hiệu lực th&igrave; trong thời hạn 20 ng&agrave;y l&agrave;m việc, cơ quan tiếp nhận hồ sơ tổ chức thẩm định hồ sơ v&agrave; tr&igrave;nh cấp c&oacute; thẩm quyền xem x&eacute;t, quyết định.</p> <p> 	<strong>* Bước 1:</strong>Nh&agrave; đầu tư nộp hồ sơ tại Bộ phận tiếp nhận v&agrave; trả kết quả thuộc Sở Gi&aacute;o dục v&agrave; Đ&agrave;o tạo.</p> <p> 	<strong>* Bước 2:</strong>Trong thời hạn 05 ng&agrave;y l&agrave;m việc, kể từ ng&agrave;y nhận được đủ hồ sơ theo quy định, Sở Gi&aacute;o dục v&agrave; Đ&agrave;o tạo c&oacute; tr&aacute;ch nhiệm kiểm tra t&iacute;nh hợp lệ của hồ sơ v&agrave; gửi hồ sơ xin &yacute; kiến của c&aacute;c cơ quan, đơn vị c&oacute; li&ecirc;n quan.</p> <p> 	Trường hợp hồ sơ kh&ocirc;ng đầy đủ theo quy định, trong thời hạn 05 ng&agrave;y l&agrave;m việc kể từ ng&agrave;y nhận hồ sơ, Sở Gi&aacute;o dục v&agrave; Đ&agrave;o tạo th&ocirc;ng b&aacute;o bằng văn bản trực tiếp hoặc qua bưu điện, thư điện tử cho nh&agrave; đầu tư biết để sửa đổi, bổ sung hồ sơ.</p> <p> 	<strong>* Bước 3:</strong>Trong thời hạn 10 ng&agrave;y l&agrave;m việc, kể từ ng&agrave;y nhận được c&ocirc;ng văn xin &yacute; kiến của Sở Gi&aacute;o dục v&agrave; Đ&agrave;o tạo, cơ quan, đơn vị được hỏi &yacute; kiến phải c&oacute; văn bản trả lời.</p> <p> 	<strong>* Bước 4:</strong>Trong thời hạn 30 ng&agrave;y l&agrave;m việc, kể từ ng&agrave;y nhận đủ hồ sơ hợp lệ, Sở Gi&aacute;o dục v&agrave; Đ&agrave;o tạo lập b&aacute;o c&aacute;o thẩm định hồ sơ, tr&igrave;nh Chủ tịch Ủy ban nh&acirc;n d&acirc;n tỉnh xem x&eacute;t, quyết định cho ph&eacute;p th&agrave;nh lập cơ sở gi&aacute;o dục mầm non, cơ sở gi&aacute;o dục phổ th&ocirc;ng c&oacute; vốn đầu tư nước ngo&agrave;i tại Việt Nam.</p> <p> 	Trường hợp hồ sơ kh&ocirc;ng được chấp thuận, trong thời hạn 05 ng&agrave;y l&agrave;m việc kể từ ng&agrave;y nhận được &yacute; kiến của cấp c&oacute; thẩm quyền,&nbsp;Sở Gi&aacute;o dục v&agrave; Đ&agrave;o tạo th&ocirc;ng b&aacute;o bằng văn bản cho nh&agrave; đầu tư, trong đ&oacute; n&ecirc;u r&otilde; l&yacute; do.</p> ","<p> 	Kh&ocirc;ng</p>","<p> 	1. Năng lực t&agrave;i ch&iacute;nh:</p> <p> 	a) Dự &aacute;n đầu tư th&agrave;nh lập cơ sở gi&aacute;o dục mầm non phải c&oacute; suất đầu tư &iacute;t nhất l&agrave; 30 triệu đồng/trẻ (kh&ocirc;ng bao gồm c&aacute;c chi ph&iacute; sử dụng đất). Tổngsố vốn đầu tư &iacute;t nhất được t&iacute;nh to&aacute;n căn cứ thời điểm c&oacute; quy m&ocirc; dự kiến cao nhất. Kế hoạch vốn đầu tư phải ph&ugrave; hợp với quy m&ocirc; dự kiến của từng giai đoạn.</p> <p> 	b) Dự &aacute;n đầu tư th&agrave;nh lập cơ sở gi&aacute;o dục phổ th&ocirc;ng phải c&oacute; suất đầu tư &iacute;t nhất l&agrave; 50 triệu đồng/học sinh (kh&ocirc;ng bao gồm c&aacute;c chi ph&iacute; sử dụng đất). Tổng số vốn đầu tư &iacute;t nhất được t&iacute;nh to&aacute;n căn cứ thời điểm c&oacute; quy m&ocirc; dự kiến cao nhất, nhưng kh&ocirc;ng thấp hơn 50 tỷ đồng.</p> <p> 	2. Cơ sở vật chất, thiết bị:</p> <p> 	2.1. Đối với cơ sở gi&aacute;o dục mầm non:</p> <p> 	a) Trường tập trung tại một địa điểm, c&oacute; m&ocirc;i trường tốt. Diện t&iacute;ch mặt bằng x&acirc;y dựng trường được x&aacute;c định tr&ecirc;n cơ sở số nh&oacute;m l&oacute;p, số trẻ với b&igrave;nh qu&acirc;n &iacute;t nhất 08 m2/trẻ đối với khu vực th&agrave;nh phố, thị x&atilde; v&agrave; 12 m2/trẻ đối với khu vực n&ocirc;ng th&ocirc;n;</p> <p> 	b) C&oacute; ph&ograve;ng học, ph&ograve;ng ngủ của trẻ v&agrave; c&aacute;c ph&ograve;ng chức năng&nbsp;ph&ugrave; hợp&nbsp;về diện t&iacute;ch, &aacute;nh s&aacute;ng, b&agrave;n ghế, thiết bị, đồ d&ugrave;ng chăm s&oacute;c v&agrave; gi&aacute;o dục trẻ;</p> <p> 	c) C&oacute;&nbsp;văn&nbsp;ph&ograve;ng nh&agrave; trường, ph&ograve;ng ban gi&aacute;m hiệu, ph&ograve;ng h&agrave;nh ch&iacute;nh quản trị, ph&ograve;ng y tế, ph&ograve;ng bảo vệ, ph&ograve;ng d&agrave;nh cho nh&acirc;n vi&ecirc;n ph&ugrave; hợp về diện t&iacute;ch, trang thiết bị, đồ d&ugrave;ng phục vụ cho việc quản l&yacute;, chăm s&oacute;c, nu&ocirc;i dưỡng v&agrave; gi&aacute;o dục trẻ;</p> <p> 	d) C&oacute; hệ thống nước sạch, hệ thống&nbsp;tho&aacute;t&nbsp;nước, ph&ograve;ng vệ sinh&nbsp;ph&ugrave; hợp, c&oacute; thiết bị vệ sinh bảo đảm an to&agrave;n, sạch sẽ, đ&aacute;p ứng mọi sinh hoạt của trường;</p> <p> 	đ) C&oacute; nh&agrave; bếp được tổ chức theo quy&nbsp;tr&igrave;nh&nbsp;hoạt động một chiều với c&aacute;c thiết bị, đồ d&ugrave;ng ph&ugrave; hợp, bảo đảm vệ sinh an to&agrave;n thực phẩm nếu trường tổ chức nấu ăn cho trẻ;</p> <p> 	e) C&oacute; s&acirc;n chơi, tường bao quanh khu vực trường, c&oacute; cổng trường với biển trường ghi r&otilde; t&ecirc;n trường theo quy định tại Điều 29 Nghị định số 86/2018/NĐ-CP;</p> <p> 	g) Trong khu vực trường c&oacute; c&acirc;y xanh. To&agrave;n bộ c&aacute;c thiết kế x&acirc;y dựng v&agrave; trang thiết bị, đồ d&ugrave;ng, đồ chơi của trường phải bảo đảm an to&agrave;n tuyệt đối cho trẻ.</p> <p> 	2.2. Đối với cơ sở gi&aacute;o dục phổ th&ocirc;ng:</p> <p> 	a) Trường tập trung tại một địa điểm, c&oacute; m&ocirc;i trường tốt. Diện t&iacute;ch mặt bằng x&acirc;y dựng trường được x&aacute;c định tr&ecirc;n cơ sở số lớp, số học sinh v&agrave; đặc điểm v&ugrave;ng miền, với mức b&igrave;nh qu&acirc;n &iacute;t nhất l&agrave; 06 m2/học sinh đối với khu vực th&agrave;nh phố, thị x&atilde; v&agrave; 10 m2/học sinh đối với khu vực n&ocirc;ng th&ocirc;n;</p> <p> 	b) C&oacute; diện t&iacute;ch d&ugrave;ng cho học tập, giảng dạy bảo đảm mức b&igrave;nh qu&acirc;n &iacute;t nhất l&agrave; 2,5 m2/học sinh;</p> <p> 	c) C&oacute; văn ph&ograve;ng nh&agrave; trường, ban gi&aacute;m hiệu, ph&ograve;ng gi&aacute;o vi&ecirc;n, ph&ograve;ng họp ph&ugrave; hợp;</p> <p> 	d) C&oacute; ph&ograve;ng học bộ m&ocirc;n (đối với trường trung học cơ sở v&agrave; trường trung học phổ th&ocirc;ng), thư viện, b&agrave;n ghế, thiết bị, đồ d&ugrave;ng giảng dạy, bảo đảm c&aacute;c ti&ecirc;u chuẩn theo quy định hiện h&agrave;nh của Bộ Gi&aacute;o dục v&agrave; Đ&agrave;o tạo;</p> <p> 	đ) C&oacute; ph&ograve;ng tập thể dục đa năng, ph&ograve;ng gi&aacute;o dục nghệ thuật, ph&ograve;ng tin học, ph&ograve;ng hỗ trợ gi&aacute;o dục học sinh t&agrave;n tật, khuyết tật học h&ograve;a nhập, ph&ograve;ng y tế học đường. C&oacute; nh&agrave; ăn, ph&ograve;ng nghỉ trưa nếu tổ chức học b&aacute;n tr&uacute;;</p> <p> 	e) C&oacute; hệ thống nước sạch, nh&agrave; vệ sinh ph&ugrave; hợp với quy m&ocirc; của cơ sở gi&aacute;o dục, bảo đảm c&aacute;c điều kiện về ti&ecirc;u chuẩn theo quy định hiện h&agrave;nh của Bộ Gi&aacute;o dục v&agrave; Đ&agrave;o tạo;</p> <p> 	g) C&oacute; s&acirc;n chơi, b&atilde;i tập, khu để xe&nbsp;với&nbsp;diện t&iacute;ch &iacute;t nhất bằng 30% tổng diện t&iacute;ch mặt bằng của trường. C&oacute; tường bao quanh khu vực trường, c&oacute; cổng trường với biển trường ghi r&otilde; t&ecirc;n trường theo quy định tại Điều 29 Nghị định số 86/2018/NĐ-CP.</p> <p> 	3. Chương tr&igrave;nh gi&aacute;o dục:</p> <p> 	3.1. Chương tr&igrave;nh gi&aacute;o dục thực hiện tại cơ sở gi&aacute;o dục c&oacute; vốn&nbsp;đầu tư&nbsp;nước ngo&agrave;i phải thể hiện mục ti&ecirc;u gi&aacute;o dục, kh&ocirc;ng c&oacute; nội dung g&acirc;y phương hại đến quốc ph&ograve;ng, an ninh quốc gia, lợi &iacute;ch cộng đồng; kh&ocirc;ng truyền b&aacute; t&ocirc;n gi&aacute;o, xuy&ecirc;n tạc lịch sử; kh&ocirc;ng ảnh hưởng xấu đến văn&nbsp;h&oacute;a, đạo đức, thuần phong mỹ tục Việt Nam v&agrave; phải bảo đảm điều kiện li&ecirc;n th&ocirc;ng giữa c&aacute;c cấp học v&agrave; tr&igrave;nh độ đ&agrave;o tạo.</p> <p> 	3.2. Cơ sở gi&aacute;o dục c&oacute; vốn đầu tư nước ngo&agrave;i được tổ chức giảng dạy:</p> <p> 	a) Chương tr&igrave;nh gi&aacute;o dục của Việt Nam theo quy định của ph&aacute;p luật Việt Nam;</p> <p> 	b) Chương tr&igrave;nh gi&aacute;o dục mầm non, chương tr&igrave;nh gi&aacute;o dục phổ th&ocirc;ng của nước ngo&agrave;i đối với c&aacute;c cơ sở gi&aacute;o dục quy định tại khoản 2 v&agrave; khoản 3 Điều 28 Nghị định n&agrave;y;</p> <p> 	3.3. Thực hiện nội dung gi&aacute;o dục, đ&agrave;o tạo bắt buộc đối với người học l&agrave; c&ocirc;ng d&acirc;n Việt Nam học tập trong c&aacute;c cơ sở gi&aacute;o dục mầm non, cơ sở gi&aacute;o dục phổ th&ocirc;ng c&oacute; vốn đầu tư nước ngo&agrave;i theo quy định của Bộ trưởng Bộ Gi&aacute;o dục v&agrave; Đ&agrave;o tạo.</p> <p> 	4. Đội ngũ nh&agrave; gi&aacute;o:</p> <p> 	4.1. Đối với cơ sở gi&aacute;o dục mầm non:</p> <p> 	a) Gi&aacute;o vi&ecirc;n &iacute;t nhất phải c&oacute; tr&igrave;nh độ cao đẳng sư phạm mầm non hoặc tương đương;</p> <p> 	b) Số trẻ em tối đa trong 01 nh&oacute;m hoặc lớp được quy định như sau:</p> <p> 	Đối&nbsp;với&nbsp;trẻ em ở độ tuổi nh&agrave; trẻ:</p> <p> 	+ Trẻ em 03 - 12 th&aacute;ng tuổi: 15 trẻ em/nh&oacute;m;</p> <p> 	+ Trẻ em 13 - 24 th&aacute;ng tuổi: 20 trẻ em/nh&oacute;m;</p> <p> 	+ Trẻ em 25 - 36 th&aacute;ng tuổi: 25 trẻ em/nh&oacute;m.</p> <p> 	Đối với trẻ em ở độ tuổi mẫu gi&aacute;o:</p> <p> 	+ Trẻ em 03 - 04 tuổi: 25 trẻ em/l&oacute;p;</p> <p> 	+ Trẻ em 04 - 05 tuổi: 30 trẻ em/lớp;</p> <p> 	+ Trẻ em 05 - 06 tuổi: 35 trẻ em/lớp.</p> <p> 	c) Số lượng gi&aacute;o vi&ecirc;n&nbsp;trong&nbsp;01 nh&oacute;m hoặc lớp được quy định như sau:</p> <p> 	+ Đối với trẻ em ở độ tuổi nh&agrave; trẻ: 05 trẻ em/gi&aacute;o vi&ecirc;n;</p> <p> 	+ Đối với trẻ em ở độ tuổi mẫu gi&aacute;o: 10 - 12 trẻ em/gi&aacute;o vi&ecirc;n.</p> <p> 	4.2. Đối với cơ sở gi&aacute;o dục phổ th&ocirc;ng:</p> <p> 	a) Gi&aacute;o vi&ecirc;n &iacute;t nhất phải c&oacute; tr&igrave;nh độ đại học sư phạm hoặc tương đương;</p> <p> 	b) Số lượng gi&aacute;o vi&ecirc;n &iacute;t nhất phải bảo đảm tỷ lệ: 1,5 gi&aacute;o vi&ecirc;n/lớp đối với trường tiểu học, 1,95 gi&aacute;o vi&ecirc;n/lớp đối với trường trung học cơ sở v&agrave; 2,25 gi&aacute;o vi&ecirc;n/lớp đối với trường trung học phổ th&ocirc;ng;</p> <p> 	c) Số lượng học sinh/lớp kh&ocirc;ng vượt qu&aacute; 30 học sinh/lớp đối với trường tiểu học, 35 học sinh/lớp đối với trường trung học cơ sở v&agrave; trung học phổ th&ocirc;ng.</p> ","7","<p> 	Nghị định số 86/2018/NĐ-CP ng&agrave;y 6 th&aacute;ng 6 năm 2018 của Chính phủ quy định về hợp t&aacute;c, đầu tư của nước ngo&agrave;i trong lĩnh vực gi&aacute;o dục.</p> ","","2020-04-16 16:03:04.426+07","0","","268296","","050083107000143083057143000151083015105083000101045143000049131000149137000081085013107000051163049000103039103000105107105199000049131000149137000081085013107000051163049000143083125000151083119105081000049109000177121105000053039153000151165000105165133049000105081107015085000151021085000178085077151000106011103","","3","t"
"126002","Chấm dứt hoạt động liên kết giáo dục theo đề nghị của các bên liên kết","42054","1.001496.000.00.00.H51","2","14","15 ngày làm việc, kể từ ngày nhận được hồ sơ hợp lệ.","Cơ quan, tổ chức","Thủ tục hành chính công mức độ 4","Quyết định","01 bộ","<p> 	<strong>* Bước 1:</strong>C&aacute;c b&ecirc;n li&ecirc;n kết nộp h&ocirc;̀ sơ tại Bộ phận tiếp nhận v&agrave; trả kết quả thuộc Sở Gi&aacute;o dục v&agrave; Đ&agrave;o tạo.</p> <p> 	<strong>* Bước 2:</strong>Trong thời hạn 15 ng&agrave;y l&agrave;m việc, kể từ ng&agrave;y nhận được đủ hồ sơ hợp lệ, cơ quan tiếp nhận hồ sơ tổ chức thẩm định, quyết định chấm dứt li&ecirc;n kết v&agrave; th&ocirc;ng b&aacute;o tr&ecirc;n phương tiện th&ocirc;ng tin đại ch&uacute;ng, nếu li&ecirc;n kết gi&aacute;o dục chưa được chấm dứt th&igrave; Gi&aacute;m đốc Sở Gi&aacute;o dục v&agrave; Đ&agrave;o tạo c&oacute; văn bản trả lời, n&ecirc;u r&otilde; l&yacute; do;</p> ","<p> 	Kh&ocirc;ng</p>","<p> 	a) Việc chấm dứt li&ecirc;n kết gi&aacute;o dục được thực hiện theo đề nghị của c&aacute;c b&ecirc;n li&ecirc;n kết.</p> <p> 	b) C&aacute;c b&ecirc;n li&ecirc;n kết khi chấm dứt hoạt động li&ecirc;n kết trước thời hạn c&oacute; tr&aacute;ch nhiệm:</p> <p> 	+ Bảo đảm cho học sinh đang theo học chương tr&igrave;nh gi&aacute;o dục t&iacute;ch hợp được tiếp tục học tập đến hết cấp học;</p> <p> 	+ Bồi ho&agrave;n cho học sinh khoản chi ph&iacute; học sinh đ&atilde; nộp trong trường hợp li&ecirc;n kết bị chấm dứt hoạt động;</p> <p> 	+ Thanh to&aacute;n c&aacute;c khoản lương, tiền c&ocirc;ng, th&ugrave; lao giảng dạy, c&aacute;c quyền lợi kh&aacute;c của gi&aacute;o vi&ecirc;n v&agrave; người lao động theo hợp đồng lao động đ&atilde; k&yacute; kết hoặc thỏa ước lao động tập thể ph&ugrave; hợp với quy định của ph&aacute;p luật lao động.</p> <p> 	+ Thanh to&aacute;n c&aacute;c khoản nợ thuế (nếu c&oacute;) v&agrave; c&aacute;c khoản nợ kh&aacute;c.</p> ","7","<p> 	Nghị định số 86/2018/NĐ-CP ng&agrave;y 6 th&aacute;ng 6 năm 2018 của Chính phủ quy định về hợp t&aacute;c, đầu tư của nước ngo&agrave;i trong lĩnh vực gi&aacute;o dục.</p> ","","2020-04-16 16:03:04.649+07","0","","11799","","050083037103000051167151000083107021151000053129105081000101085067105000099069151000081085013107000051163049000151083055107000053071000105081083095000049159011000049013049000047067105000101085067105000099069151","","3","t"
"126003","Gia hạn, điều chỉnh hoạt động liên kết giáo dục","42053","1.001497.000.00.00.H51","2","14","10 ngày làm việc, kể từ ngày nhận được hồ sơ hợp lệ.
Trường hợp điều chỉnh liên kết giáo dục trong đó có điều chỉnh chương trình giáo dục tích hợp thì thời gian giải quyết tối thiểu là 40 ngày làm việc kể từ ngày nhận đủ hồ sơ hợp lệ (bao gồm cả thời gian đề nghị Bộ Giáo dục và Đào tạo phê duyệt việc điều chỉnh chương trình giáo dục tích hợp).","Cơ quan, tổ chức","Thủ tục hành chính công mức độ 4","Quyết định","01 bộ","<p> 	<strong>* Bước 1:</strong>C&aacute;c b&ecirc;n li&ecirc;n kết nộp h&ocirc;̀ sơ tại Bộ phận tiếp nhận v&agrave; trả kết quả thuộc Sở Gi&aacute;o dục v&agrave; Đ&agrave;o tạo.</p> <p> 	<strong>* Bước 2:</strong>Trong thời hạn 05 ng&agrave;y l&agrave;m việc, kể từ ng&agrave;y tiếp nhận hồ sơ, nếu hồ sơ kh&ocirc;ng đầy đủ theo quy định, cơ quan tiếp nhận hồ sơ th&ocirc;ng b&aacute;o bằng văn bản gửi trực tiếp hoặc qua bưu điện hoặc thư điện tử cho c&aacute;c b&ecirc;n li&ecirc;n kết.</p> <p> 	<strong>* Bước 3: </strong>Trong thời hạn 10 ng&agrave;y l&agrave;m việc, kể từ ng&agrave;y nhận được đủ hồ sơ, cơ quan tiếp nhận hồ sơ tổ chức thẩm định, quyết định ph&ecirc; duyệt gia hạn hoặc điều chỉnh li&ecirc;n kết gi&aacute;o dục;</p> <p> 	Trường hợp li&ecirc;n kết đ&agrave;o tạo kh&ocirc;ng được gia hạn, điều chỉnh, cơ quan tiếp nhận hồ sơ phải trả lời bằng văn bản, trong đ&oacute; n&ecirc;u r&otilde; l&yacute; do.</p> <p> 	Trường hợp điều chỉnh li&ecirc;n kết gi&aacute;o dục trong đ&oacute; c&oacute; điều chỉnh chương tr&igrave;nh gi&aacute;o dục t&iacute;ch hợp th&igrave; Sở Gi&aacute;o dục v&agrave; Đ&agrave;o tạo c&oacute; tr&aacute;ch nhiệm thực hiện việc gửi hồ sơ đề nghị ph&ecirc; duyệt điều chỉnh chương tr&igrave;nh gi&aacute;o dục t&iacute;ch hợp đến Bộ Gi&aacute;o dục v&agrave; Đ&agrave;o tạo theo quy định.</p> ","<p> 	Kh&ocirc;ng</p>","<p> 	+ Việc gia hạn li&ecirc;n kết gi&aacute;o dục phải được thực hiện trong thời hạn 06 th&aacute;ng trước khi li&ecirc;n kết gi&aacute;o dục hết thời hạn.</p> <p> 	+ Thực hiện đ&uacute;ng quy định trong Quyết định ph&ecirc; duyệt li&ecirc;n kết gi&aacute;o dục, kh&ocirc;ng c&oacute; h&agrave;nh vi vi phạm ph&aacute;p luật Việt Nam v&agrave; ph&aacute;p luật nước ngo&agrave;i;</p> ","7","<p> 	Nghị định số 86/2018/NĐ-CP ng&agrave;y 6 th&aacute;ng 6 năm 2018 của Chính phủ quy định về hợp t&aacute;c, đầu tư của nước ngo&agrave;i trong lĩnh vực gi&aacute;o dục.</p> ","","2020-04-16 16:03:05.29+07","0","","268295","","082085011000083021105199000053085071153000049083091105083000083107021151000053129105081000101085067105000099069151000081085013107000051163049","","3","t"
"126005","Xét, duyệt chính sách hỗ trợ đối với học sinh trung học phổ thông là người dân tộc thiểu số","42004","1.004436.000.00.00.H51","2","14","-	Kinh phí hỗ trợ tiền ăn và tiền nhà ở cho học sinh được chi trả, cấp phát hằng tháng.
-	Gạo được cấp cho học sinh theo định kỳ nhưng không quá 2 lần/học kỳ.","Cá nhân","Trực tiếp tại cơ quan hành chính hoặc qua đường bưu điện - Mức độ 2","Quyết định","01","<p> 	a) Bước 1: V&agrave;o thời điểm học sinh đầucấp l&agrave;m thủtục nhập học, nh&agrave; trường tổ chức phổ biến, th&ocirc;ng b&aacute;o rộng r&atilde;i, hướng dẫn cho bố, mẹ (hoặc người gi&aacute;m hộ hợp ph&aacute;p) v&agrave; học sinh thuộc đối tượng được hưởng ch&iacute;nh s&aacute;ch chuẩn bị hồ sơ đềnghị hỗ trợ.</p> <p> 	b) Bước 2: Trong thời hạn 10 ng&agrave;y l&agrave;m việc, k&ecirc; từ ng&agrave;y nh&agrave; trường ni&ecirc;m yết th&ocirc;ng b&aacute;o, gia đ&igrave;nh hoặc học sinh nộp đ&acirc;y đủh&ocirc; sơ cho cơ sở gi&aacute;o dục.</p> <p> 	c) Bước 3: Cơ sở gi&aacute;o dục tiếp nhận hồ sơ; lập danh s&aacute;ch. Trong thời hạn 5 ng&agrave;y l&agrave;m việc, k&ecirc; từ ng&agrave;y hết hạn n&ocirc;p h&ocirc; sơ, nh&agrave; trường tổ chức x&eacute;t duyệt v&agrave; l&acirc;p h&ocirc; sơ theo quy định v&agrave; gửi v&ecirc; Sở giao duc va đao tao.</p> <p> 	d) Bước 4: Sở gi&aacute;o dục v&agrave; đ&agrave;o tạo tiếp nhận hồ sơ của cơ sở gi&aacute;o dục. Trong thời hạn 5 ng&agrave;y l&agrave;m việc, k&ecirc; từ khi nhận được h&ocirc; sơ đ&ecirc; nghị hỗ trợ của c&aacute;c nh&agrave; trường, sở gi&aacute;o dục v&agrave; đ&agrave;o tạo tổng hợp , thẩm định tr&igrave;nh Uỷ ban nh&acirc;n d&acirc;n cấp tỉnh ph&ecirc; duy&ecirc;t.</p> <p> 	đ) Bước 5: Ủy ban nh&acirc;n d&acirc;n c&acirc;p tỉnh nhận hồ sơ đề nghị của sở gi&aacute;o dục v&agrave; đ&agrave;o tạo. Trong thời hạn 3 ng&agrave;y l&agrave;m việc, kể từ khi nhận hồ sơ tr&igrave;nh của sở gi&aacute;o dục v&agrave; đ&agrave;o tạo, Ủy ban nh&acirc;n d&acirc;n c&acirc;p tỉnh xem x&eacute;t , ban hanh Quyết định ph&ecirc; duyệt.</p> <p> 	e) Bước 6: Sở gi&aacute;o dục v&agrave; đ&agrave;o tạo gửi c&aacute;c trường kết quả ph&ecirc; duyệt học sinh được hưởng ch&iacute;nh s&aacute;ch hỗ trợ để nh&agrave; trường th&ocirc;ng b&aacute;o c&ocirc;ng khai v&agrave; tổ chức triển khai thực hiện.</p> ","<p> 	Kh&ocirc;ng</p>","<p> 	Đối với học sinh trung học phổ th&ocirc;ng l&agrave; người d&acirc;n tộc thiểu số</p> <p> 	a) Đang học trường trung học phổ th&ocirc;ng hoặc cấp trung học phổ th&ocirc;ng tại trường phổ th&ocirc;ng c&oacute; nhiều cấp học .</p> <p> 	b) Bản th&acirc;n v&agrave; bố, mẹ hoặc người gi&aacute;m hộ c&oacute; hộ khẩu thường tr&uacute; tại x&atilde; khu vực III, th&ocirc;n đặc biệt kh&oacute; khăn v&ugrave;ng d&acirc;n tộc v&agrave; miền n&uacute;i; c&aacute;c x&atilde; đặc biệt kh&oacute; khăn v&ugrave;ng b&atilde;i ngang ven biển v&agrave; hải đảo.</p> <p> 	c) Nh&agrave; ở xa trường khoảng c&aacute;ch từ 10 km trở l&ecirc;n hoặc địa h&igrave;nh c&aacute;ch trở , giao th&ocirc;ng đi lại kh&oacute; khăn: phải qua s&ocirc;ng, suối kh&ocirc;ng c&oacute; cầu; qua đ&egrave;o, n&uacute;i cao; qua v&ugrave;ng sạt lở đất, đ&aacute;.</p> ","6","<p> 	Nghị định số 116/2016/NĐ-CP ng&agrave;y 18 th&aacute;ng 7 năm 2016 của Ch&iacute;nh phủ Quy đinh ch&iacute;nh s&aacute;ch hỗ trợ học sinh b&aacute;n tr&uacute; , trường phổ th&ocirc;ng d&acirc;n tộc b&aacute;n tr&uacute; v&agrave; học sinh trung học phổ th&ocirc;ng ở x&atilde;, th&ocirc;n đặc biệt kh&oacute; khăn.</p> ","","2020-04-16 16:03:05.78+07","0","","268248","","182057151199000051153183077151000049083087105083000149013049083000083127000151147141000053121085000177133085000083117049000149085105083000151147153105081000083117049000143083125000151083119105081000101015000105081165135085000051035105000151129049000151083085073153000149121","","1","f"
