"tt_id","tt_ten","tt_id_dv","tt_ma","lv_id","dv_id","tt_thoihan_gq","dtth_ten","ctth_ten","kq_ten","tt_sobo_tphs","tt_trinhtu_th","tt_lephi","tt_yeucau_dk","tt_revision","tt_cancu_pl","tt_ghichu","ngaycapnhatcuoi","tt_stt","tt_ngung_sd","qt_id","vbpl_banhanhtt","tt_ten_kd","tt_link_lienket","ctth_id","sd_buuchinh"
"120198","Cấp giấy chứng nhận kiểm định chất lượng giáo dục mầm non","744","QT019_GD-ĐT","2","14","120 ngày","Tổ chức","Trực tiếp tại cơ quan, qua mạng Internet hoặc qua đường bưu điện (Mức 3)","Giấy chứng nhận","01","<p> 	- Trường mầm non chu&acirc;̉n bị h&ocirc;̀ sơ đ&acirc;̀y đủ theo quy định n&ocirc;̣p tại B&ocirc;̣ ph&acirc;̣n TN&amp;TKQthuộc Văn ph&ograve;ng HĐND v&agrave; UBND cấp huyện v&agrave; thực hi&ecirc;̣n TTHC theo quy định.</p> <p> 	- Ph&ograve;ng Gi&aacute;o dục v&agrave; Đ&agrave;o tạo c&oacute; tr&aacute;ch nhiệm:</p> <p> 	&nbsp; + Tiếp nhận, kiểm tra hồ sơ đăng k&yacute; đ&aacute;nh gi&aacute; ngo&agrave;i của trường mầm non tr&ecirc;n địa b&agrave;n thuộc phạm vi quản l&yacute; v&agrave; th&ocirc;ng tin cho trường mầm non biết hồ sơ được chấp nhận hoặc y&ecirc;u cầu tiếp tục ho&agrave;n thiện.</p> <p class=""sonvb"" style=""margin-top:5.0pt;margin-right:0cm;margin-bottom:0cm; margin-left:0cm;margin-bottom:.0001pt;line-height:normal""> 	&nbsp;+ Gửi hồ sơ đăng k&yacute; đ&aacute;nh gi&aacute; ngo&agrave;i của trường mầm non đ&atilde; được chấp nhận đến Trung t&acirc;m Phục vụ h&agrave;nh ch&iacute;nh c&ocirc;ng tỉnh S&oacute;c Trăng(số 19, đường Trần Hưng Đạo, phường 3, th&agrave;nh phố S&oacute;c Trăng, c&oacute; thể nộp trực tiếp hoặc qua đường bưu điện)</p> <p> 	Cán b&ocirc;̣ l&agrave;m việc tại Trung t&acirc;m Phục vụ h&agrave;nh ch&iacute;nh c&ocirc;ng tỉnh S&oacute;c Trăngti&ecirc;́p nh&acirc;̣n h&ocirc;̀ sơ ki&ecirc;̉m tra đ&acirc;̀u mục h&ocirc;̀ sơ</p> <p> 	- N&ecirc;́u hợp l&ecirc;̣, vào s&ocirc;̉ theo dõi h&ocirc;̀ sơ; vi&ecirc;́t gi&acirc;́y ti&ecirc;́p nh&acirc;̣n h&ocirc;̀ sơ và hẹn trả k&ecirc;́t quả trao cho người n&ocirc;̣p h&ocirc;̀ sơ; chuy&ecirc;̉n h&ocirc;̀ sơ kèm theo phi&ecirc;́u ki&ecirc;̉m soát quá trình giải quy&ecirc;́t h&ocirc;̀ sơ đ&ecirc;́n cán b&ocirc;̣ chuy&ecirc;n xử lý</p> <p class=""sonvb"" style=""margin-top:5.0pt;margin-right:0cm;margin-bottom:0cm; margin-left:0cm;margin-bottom:.0001pt;line-height:normal""> 	- N&ecirc;́u h&ocirc;̀ sơ kh&ocirc;ng hợp l&ecirc;̣, hướng d&acirc;̃n người n&ocirc;̣p h&ocirc;̀ sơ hoàn thi&ecirc;̣n bằng phi&ecirc;́u hướng d&acirc;̃n hoàn thi&ecirc;̣n h&ocirc;̀ sơ.</p> <p> 	+ Tiếp nhận, kiểm tra hồ sơ đăng k&yacute; đ&aacute;nh gi&aacute; ngo&agrave;i từ c&aacute;c Ph&ograve;ng Gi&aacute;o dục v&agrave; Đ&agrave;o tạo, th&ocirc;ng tin cho Ph&ograve;ng Gi&aacute;o dục v&agrave; Đ&agrave;o tạo biết hồ sơ được chấp nhận để đ&aacute;nh gi&aacute; ngo&agrave;i hoặc y&ecirc;u cầu tiếp tục ho&agrave;n thiện.</p> <p> 	+ Tiếp nhận, kiểm tra hồ sơ đăng k&yacute; đ&aacute;nh gi&aacute; ngo&agrave;i từ c&aacute;c trường mầm non tr&ecirc;n địa b&agrave;n thuộc phạm vi quản l&yacute;,th&ocirc;ng tin cho trường mầm non biết hồ sơ đ&atilde; được chấp nhận để đ&aacute;nh gi&aacute; ngo&agrave;i hoặc y&ecirc;u cầu tiếp tục ho&agrave;n thiện.</p> <p> 	+ Tr&igrave;nh Gi&aacute;m đốc th&agrave;nh lập đo&agrave;n đ&aacute;nh gi&aacute; ngo&agrave;i v&agrave; triển khai c&aacute;c bước trong quy tr&igrave;nh đ&aacute;nh gi&aacute; ngo&agrave;i trong thời hạn 03 th&aacute;ng kểtừ ng&agrave;y th&ocirc;ng tin cho Ph&ograve;ng Gi&aacute;o dục v&agrave; Đ&agrave;o tạo hoặc trường mầm non biết hồ sơ đ&atilde; được chấp nhận đểđ&aacute;nh gi&aacute; ngo&agrave;i.</p> <p> 	+ Quy tr&igrave;nh đ&aacute;nh gi&aacute; ngo&agrave;i trường mầm non gồm c&aacute;c bước sau:</p> <p> 	- Nghi&ecirc;n cứu hồ sơ đ&aacute;nh gi&aacute;.</p> <p> 	- Khảo s&aacute;t sơ bộ tại trường mầm non.</p> <p> 	- Khảo s&aacute;t ch&iacute;nh thức tại trường mầm non.</p> <p> 	- Dự thảo b&aacute;o c&aacute;o đ&aacute;nh gi&aacute; ngo&agrave;i</p> <p> 	- Lấy &yacute; kiến phản hồi của trường mầm non về dựthảo b&aacute;o c&aacute;o đ&aacute;nh gi&aacute; ngo&agrave;i.</p> <p> 	- Ho&agrave;n thiện b&aacute;o c&aacute;o đ&aacute;nh gi&aacute; ngo&agrave;i.</p> <p class=""sonvb"" style=""margin-top:5.0pt;margin-right:0cm;margin-bottom:0cm; margin-left:0cm;margin-bottom:.0001pt;line-height:normal""> 	+ Sau khi thống nhất trong đo&agrave;n đ&aacute;nh gi&aacute; ngo&agrave;i, đo&agrave;n đ&aacute;nh gi&aacute; ngo&agrave;i gửi dự thảo b&aacute;o c&aacute;o đ&aacute;nh gi&aacute; ngo&agrave;i cho trường mầm non để lấy &yacute; kiến phản hồi.</p> <p class=""sonvb"" style=""margin-top:5.0pt;margin-right:0cm;margin-bottom:0cm; margin-left:0cm;margin-bottom:.0001pt;line-height:normal""> 	Trường mầm non c&oacute; tr&aacute;ch nhiệm gửi c&ocirc;ng văn cho đo&agrave;n đ&aacute;nh gi&aacute; ngo&agrave;i n&ecirc;u r&otilde; &yacute; kiến nhất tr&iacute; hoặc kh&ocirc;ng nhất tr&iacute; với bản dự thảo b&aacute;o c&aacute;o đ&aacute;nh gi&aacute; ngo&agrave;i. Trường hợp kh&ocirc;ng nhất tr&iacute; với dự thảo b&aacute;o c&aacute;o đ&aacute;nh gi&aacute; ngo&agrave;i phải n&ecirc;u r&otilde; l&yacute; do.</p> <p class=""sonvb"" style=""margin-top:5.0pt;margin-right:0cm;margin-bottom:0cm; margin-left:0cm;margin-bottom:.0001pt;line-height:normal""> 	Đo&agrave;n đ&aacute;nh gi&aacute; ngo&agrave;i th&ocirc;ng b&aacute;o bằng văn bản cho trường mầm non biết những &yacute; kiến tiếp thu hoặc bảo lưu, trường hợp bảo lưu &yacute; kiến phải n&ecirc;u r&otilde; l&yacute; do.</p> <p> 	Tổng hợp hồ sơ đ&atilde; ho&agrave;n thiện, tr&igrave;nh l&atilde;nh đạo Sở xem x&eacute;t v&agrave; ph&ecirc; duyệt. Đồng thời kết quả kiểm định phải được c&ocirc;ng bố c&ocirc;ng khai tr&ecirc;n website của Sở GD&amp;ĐT</p> <p> 	Tiếp nhận kết quả, v&agrave;o sổ theo d&otilde;i bàn giao k&ecirc;́t quả v&ecirc;̀ Trung t&acirc;m Phục vụ h&agrave;nh ch&iacute;nh c&ocirc;ng tỉnh S&oacute;c Trăng</p> <p> 	Lưu h&ocirc;̀ sơ theo dõi</p> <p> 	Trả k&ecirc;́t quả cho c&ocirc;ng d&acirc;n theo quy định</p> ","<p> 	Kh&ocirc;ng</p>","<p> 	* Điều kiện c&ocirc;ng nhận trường đạt kiểm định chất lượng gi&aacute;o dục</p> <p> 	+ Hoạt động gi&aacute;o dục &iacute;t nhất 05năm.</p> <p> 	+ C&oacute; kết quả đ&aacute;nh gi&aacute; ngo&agrave;i đạt từ Mức1 trở l&ecirc;n.</p> <p> 	* Cấp độ c&ocirc;ng nhận:</p> <p> 	-Cấp độ 1: Trường được đ&aacute;nh gi&aacute; đạt Mức 1;</p> <p> 	-Cấp độ 2: Trường được đ&aacute;nh gi&aacute; đạt Mức 2;</p> <p> 	-Cấp độ 3: Trường được đ&aacute;nh gi&aacute; đạt Mức 3;</p> <p> 	-Cấp độ 4: Trường được đ&aacute;nh gi&aacute; đạt Mức 4;</p> <p> 	Ti&ecirc;u chuẩn đ&aacute;nh gi&aacute; trường mầm non c&aacute;c Mức 1, 2, 3 v&agrave; 4&nbsp;</p> ","87","<p> 	Th&ocirc;ng tư số 19/2018/TT-BGDĐT ng&agrave;y 22 th&aacute;ng 8 năm 2018 của Bộ trưởng Bộ Gi&aacute;o dục v&agrave; Đ&agrave;o tạo ban h&agrave;nh Quy định về kiểm định chất lượng gi&aacute;o dục v&agrave; c&ocirc;ng nhận đạt chuẩn quốc gia đối trường mầm non.</p> ","","2020-02-26 13:49:18.077+07","0","","12283","","050037143000081085037183000049083167105081000105083045105000099085073103000053095105083000049083037151000101165141105081000081085013107000051163049000103039103000105107105","","2","t"
"120162","Thành lập trường phổ thông trung học công lập hoặc cho phép thành lập trường phổ thông trung học tư thục","45847","TT01_GDDT","2","14","25 ngày làm việc","Cá nhân, tổ chức","Trực tiếp tại cơ quan, qua mạng Internet hoặc qua đường bưu điện (Mức 3)","Quyết định hành chính","01","<p style=""margin-left:-3.55pt;""> 	Ủy ban nh&acirc;n d&acirc;n cấp huyện; tổ chức hoặc c&aacute; nh&acirc;n gửi trực tiếp hoặc qua bưu điện 01 bộ hồ sơ đến Trung t&acirc;m phục vụ h&agrave;nh ch&iacute;nh c&ocirc;ng tỉnh S&oacute;c Trăng <strong>(</strong>số 19, đường Trần Hưng Đạo, phường 3, th&agrave;nh phố S&oacute;c Trăng).</p> <p> 	Sở Gi&aacute;o dục v&agrave; Đ&agrave;o tạo tiếp nhận hồ sơ. Trong thời hạn 20 ng&agrave;y l&agrave;m việc, kể từ ng&agrave;y nhận đủ hồ sơ hợp lệ, nếu đủ điều kiện, Sở Gi&aacute;o dục v&agrave; Đ&agrave;o tạo chủ tr&igrave;, phối hợp với c&aacute;c ph&ograve;ng chuy&ecirc;n m&ocirc;n c&oacute; li&ecirc;n quan thẩm định hồ&nbsp;sơ v&agrave; thẩm định thực tế điều kiện th&agrave;nh lập trường trung học; nếu đủ điều kiện th&igrave; c&oacute; &yacute; kiến bằng văn bản v&agrave; gửi hồ sơ đề nghị th&agrave;nh lập hoặc cho ph&eacute;p th&agrave;nh lập trường đến Ủy ban nh&acirc;n d&acirc;n cấp tỉnh; nếu chưa đủ điều kiện th&igrave; c&oacute; văn bản th&ocirc;ng b&aacute;o cho Ủy ban nh&acirc;n d&acirc;n cấp huyện hoặc tổ chức, c&aacute; nh&acirc;n đề nghị th&agrave;nh lập trường n&ecirc;u r&otilde; l&yacute; do;</p> <p> 	c) Trong thời hạn 05 ng&agrave;y l&agrave;m việc, kể từ ng&agrave;y nhận đủ hồ sơ hợp lệ, Ủy ban nh&acirc;n d&acirc;n cấp tỉnh quyết định th&agrave;nh lập hoặc cho ph&eacute;p th&agrave;nh lập trường; nếu chưa quyết định th&agrave;nh lập hoặc cho ph&eacute;p th&agrave;nh lập trường th&igrave; c&oacute; văn bản th&ocirc;ng b&aacute;o cho Sở Gi&aacute;o dục v&agrave; Đ&agrave;o tạo v&agrave; tổ chức, c&aacute; nh&acirc;n đề nghị th&agrave;nh lập trường n&ecirc;u r&otilde; l&yacute; do.</p> ","<p> 	Kh&ocirc;ng</p>","<div id=""aui_3_4_0_1_2582"" style=""padding: 0px; margin: 0px; box-sizing: border-box; color: rgb(51, 51, 51); font-family: Arial, Tahoma, Helvetica; background-color: rgb(240, 240, 240);""> 	<font face=""Arial, Verdana"" id=""aui_3_4_0_1_2581"" style=""padding: 0px; margin: 0px; box-sizing: border-box;""><span id=""aui_3_4_0_1_2580"" style=""padding: 0px; margin: 0px; box-sizing: border-box; font-size: 13.3333px;"">- C&oacute; Đề &aacute;n th&agrave;nh lập trường ph&ugrave; hợp với quy hoạch ph&aacute;t triển kinh tế - x&atilde; hội v&agrave; quy hoạch mạng lưới cơ sở gi&aacute;o dục đ&atilde; được cơ quan c&oacute; thẩm quyền ph&ecirc; duyệt;</span></font></div> <div style=""padding: 0px; margin: 0px; box-sizing: border-box; color: rgb(51, 51, 51); font-family: Arial, Tahoma, Helvetica; background-color: rgb(240, 240, 240);""> 	<font face=""Arial, Verdana"" style=""padding: 0px; margin: 0px; box-sizing: border-box;""><span style=""padding: 0px; margin: 0px; box-sizing: border-box; font-size: 13.3333px;"">- Đề &aacute;n th&agrave;nh lập trường x&aacute;c định r&otilde; mục ti&ecirc;u, nhiệm vụ, chương tr&igrave;nh v&agrave; nội dung gi&aacute;o dục; đất đai, cơ sở vật chất, thiết bị, địa điểm dự kiến x&acirc;y dựng trường, tổ chức bộ m&aacute;y, nguồn lực v&agrave; t&agrave;i ch&iacute;nh; phương hướng chiến lược x&acirc;y dựng v&agrave; ph&aacute;t triển nh&agrave; trường.</span></font></div> ","10","<p> 	- Nghị định số&nbsp;<a href=""https://thuvienphapluat.vn/van-ban/dau-tu/nghi-dinh-46-2017-nd-cp-quy-dinh-dieu-kien-dau-tu-hoat-dong-trong-linh-vuc-giao-duc-336219.aspx"" target=""_blank"" title=""Nghị định 46/2017/NĐ-CP"">46/2017/NĐ-CP</a>&nbsp;ng&agrave;y 21/4/2017 của Ch&iacute;nh phủ quy định về điều kiện đầu tư v&agrave; hoạt động trong lĩnh vực gi&aacute;o dục;</p> <p> 	- Nghị định số&nbsp;<a href=""https://thuvienphapluat.vn/van-ban/thuong-mai/nghi-dinh-135-2018-nd-cp-sua-doi-nghi-dinh-46-2017-nd-cp-dau-tu-trong-linh-vuc-giao-duc-315730.aspx"" target=""_blank"" title=""Nghị định 135/2018/NĐ-CP"">135/2018/NĐ-CP</a>&nbsp;ng&agrave;y 04/10/2018 của Ch&iacute;nh phủ sửa đổi một số điều của Nghị định&nbsp;<a href=""https://thuvienphapluat.vn/van-ban/dau-tu/nghi-dinh-46-2017-nd-cp-quy-dinh-dieu-kien-dau-tu-hoat-dong-trong-linh-vuc-giao-duc-336219.aspx"" target=""_blank"" title=""Nghị định 46/2017/NĐ-CP"">46/2017/NĐ-CP</a>&nbsp;ng&agrave;y 21/4/2017 của Ch&iacute;nh phủ quy định về điều kiện đầu tư v&agrave; hoạt động trong lĩnh vực gi&aacute;o dục.</p> ","","2020-02-26 13:49:04.576+07","0","","11723","","152083015105083000101045143000151147165135105081000143083125000151083119105081000151147153105081000083117049000049119105081000101045143000083107033049000049083107000143083057143000151083015105083000101045143000151147165135105081000143083125000151083119105081000151147153105081000083117049000151165000151083163049","","2","t"
"120168","Cho phép hoạt động đối với cơ sở giáo dục mầm non; cơ sở giáo dục phổ thông; cơ sở đào tạo, bồi dưỡng ngắn hạn có vốn đầu tư nước ngoài tại Việt Nam","42056","TT054_GDDT","2","14","20 ngày","Cá nhân","Thủ tục hành chính công mức độ 4","Quyết định","","<p> 	<strong>* Bước 1:</strong>Nh&agrave; đầu tưgửi h&ocirc;̀ sơ đăng k&yacute; hoạt động gi&aacute;o dục đến Bộ phận tiếp nhận v&agrave; trả kết quả thuộc Sở Gi&aacute;o dục v&agrave; Đ&agrave;o tạo.</p> <p> 	<strong>* Bước 2:</strong>Trường hợp hồ sơ kh&ocirc;ng đầy đủ, trong thời hạn 05 ng&agrave;y l&agrave;m việc, kể từ ng&agrave;y tiếp nhận hồ sơ, Sở Gi&aacute;o dục v&agrave; Đ&agrave;o tạo th&ocirc;ng b&aacute;o bằng văn bản gửi trực tiếp hoặc qua bưu điện hoặc thư điện tử cho nh&agrave; đầu tư.</p> <p> 	<strong>* Bước 3:</strong>Trong v&ograve;ng 20 ng&agrave;y l&agrave;m việc, kể từ ng&agrave;y nhận được hồ sơ hợp lệ theo quy định, Sở Gi&aacute;o dục v&agrave; Đ&agrave;o tạo chủ tr&igrave;, phối hợp với c&aacute;c cơ quan, đơn vị c&oacute; li&ecirc;n quan thẩm định theo quy định, tr&igrave;nh c&aacute;c cấp c&oacute; thẩm quyền xem x&eacute;t, quyết định cho ph&eacute;p hoạt động.</p> <p> 	Trường hợp cơ sở gi&aacute;o dục chưa đủ điều kiện để hoạt động, trong thời hạn 05 ng&agrave;y l&agrave;m việc, kể từ ng&agrave;y nhận được &yacute; kiến của c&aacute;c cấp c&oacute; thẩm quyền, cơ quan tiếp nhận hồ sơ trả lời bằng văn bản, trong đ&oacute; n&ecirc;u r&otilde; l&yacute; do</p> ","<p> 	Kh&ocirc;ng</p>","<p> 	+ C&oacute; Quyết định th&agrave;nh lập cơ sở gi&aacute;o dục mầm non/cơ sở gi&aacute;o dục phổ th&ocirc;ng c&oacute; vốn đầu tư nước ngo&agrave;i; hoặc giấy chứng nhận đăng k&yacute; đầu tư v&agrave; giấy chứng nhận đăng k&yacute; doanh nghiệp đối với cơ sở đ&agrave;o tạo, bồ dưỡng ngắn hạn c&oacute; vốn đầu tư nước ngo&agrave;i.</p> <p> 	+ C&oacute; quy chế tổ chức v&agrave; hoạt động của cơ sở gi&aacute;o dục mầm non/cơ sở gi&aacute;o dục phổ th&ocirc;ng ph&ugrave; hợp với quy định của ph&aacute;p luật.</p> <p> 	+ Đ&aacute;p ứng c&aacute;c điều kiện về vốn đầu tư, cơ sở vật chất, thiết bị, chương tr&igrave;nh gi&aacute;o dục, đội ngũ nh&agrave; gi&aacute;o quy định tại c&aacute;c Điều 35, 36, 37, 38 của Nghị định số 86/2018/NĐ-CP.</p> ","6","","","2020-02-26 13:49:08.281+07","0","","268297","","0500831070001430830571430000831070211510000531291050810000531210850001771330850000491310001491370000810850131070000511630490001030391030001051071052040000491310001491370000810850131070000511630490001430831250001510831191050812040000491310001491370000530151070001510211071990000471230850000511651391050810001050810251050000830211050000491070-10001771190-11050000530350-11530001511650001051651310-10490001050811070110-1085000151021085000178085077151000106011103","","3","t"
"120173","Xét, duyệt chính sách hỗ trợ đỗi với học sinh trung học phổ thông là người dân tộc Kinh","42005","TT048_GDDT","2","14","-	Kinh phí hỗ trợ tiền ăn và tiền nhà ở cho học sinh được chi trả, cấp phát hằng tháng.
-	Gạo được cấp cho học sin h theo định kỳ nhưng không qua 2 lần/học kỳ.","Cá nhân","Trực tiếp tại cơ quan hành chính hoặc qua đường bưu điện - Mức độ 2","Quyết định","01","<p> 	a) Bước 1: V&agrave;o thời điểm học sinh đầu cấp l&agrave;m thủ tục nhập học, nh&agrave; trường tổ chức phổ biến, th&ocirc;ng b&aacute;o rộng r&atilde;i, hướng dẫn cho bố, mẹ (hoặc người gi&aacute;m hộ hợp ph&aacute;p) v&agrave; học sinh thuộc đối tượng được hưởng ch&iacute;nh s&aacute;ch chuẩn bịhồsơ đề nghị hỗ trợ.</p> <p> 	b) Bước 2: Trong thời hạn 10 ng&agrave;y l&agrave;m việc, kể từ ng&agrave;y nh&agrave; trường ni&ecirc;m yết th&ocirc;ng b&aacute;o, gia đ&igrave;nh hoặc học sinh nộp đầy đủhồsơ cho cơ sở gi&aacute;o dục.</p> <p> 	c) Bước 3: Cơ sở gi&aacute;o dục tiếp nhận hồ sơ; lập danh s&aacute;ch. Trong thời hạn 5 ng&agrave;y l&agrave;m việc, kể từ ng&agrave;y hết hạn nộp hồsơ, nh&agrave; trường tổ chức x&eacute;t duyệt v&agrave; lập hồ sơ theo quy định v&agrave; gửi vềSở gi&aacute;o dục v&agrave; đ&agrave;o tạo.</p> <p> 	d) Bước 4: Sở gi&aacute;o dục v&agrave; đ&agrave;o tạo tiếp nhận hồ sơ của cơ sở gi&aacute;o dục. Trong thời hạn 5 ng&agrave;y l&agrave;m việc, kể từ khi nhận được hồ sơ đề nghị hỗ trợ của c&aacute;c nh&agrave; trường, sở gi&aacute;o dục v&agrave; đ&agrave;o tạo tổng hợp, thẩm định tr&igrave;nh Uỷ ban nh&acirc;n d&acirc;n cấp tỉnh ph&ecirc; duy&ecirc;t.</p> <p> 	đ) Bước 5: Ủy ban nh&acirc;n d&acirc;n cấp tỉnh nhận hồ sơ đề nghị của sở gi&aacute;o dục v&agrave; đ&agrave;o tạo. Trong thời hạn 3 ng&agrave;y l&agrave;m việc, kể từ khi nhận hồ sơ tr&igrave;nh của sở gi&aacute;o dục v&agrave; đ&agrave;o tạo, Ủy ban nh&acirc;n d&acirc;n cấp tỉnh xem x&eacute;t, ban h&agrave;nh Quyết định ph&ecirc; duyệt.</p> <p> 	e) Bước 6: Sở gi&aacute;o dụcv&agrave; đ&agrave;o tạo gửi c&aacute;c trường kết quả ph&ecirc; duyệt học sinh được hưởng ch&iacute;nh s&aacute;ch hỗ trợ để nh&agrave; trường th&ocirc;ng b&aacute;o c&ocirc;ng khai v&agrave; tổ chức triển khai thực hiện.</p> ","<p> 	Kh&ocirc;ng</p>","<p> 	Đối với học sinh trung học phổ th&ocirc;ng l&agrave; người d&acirc;n tộc kinh</p> <p> 	a) Đang học trường trung học phổ th&ocirc;ng hoặc cấp trung học phổ th&ocirc;ng tại trường phổ th&ocirc;ng c&oacute; nhiều cấp học.</p> <p> 	b) Bản th&acirc;n v&agrave; bố, mẹ hoặc người gi&aacute;m hộ c&oacute; hộ khẩu thường tr&uacute; tại x&atilde; khu vực III, th&ocirc;n đặc biệt kh&oacute; khăn v&ugrave;ng d&acirc;n tộc v&agrave; miền n&uacute;i; c&aacute;c x&atilde; đặc biệt kh&oacute; khăn v&ugrave;ng b&atilde;i ngang ven biển v&agrave; hải đảo.</p> <p> 	c) Nh&agrave; ở xa trường khoảng c&aacute;ch từ 10 km trở l&ecirc;n hoặc địa h&igrave;nh c&aacute;ch trở , giao th&ocirc;ng đi lại kh&oacute; khăn: phải qua s&ocirc;ng, suối kh&ocirc;ng c&oacute; cầu; qua đ&egrave;o, n&uacute;i cao; qua v&ugrave;ng sạt lở đất, đ&aacute;.</p> <p> 	d) L&agrave; nh&acirc;n khẩu trong gia đ&igrave;nh thuộc hộ ngh&egrave;o.</p> ","3","<p> 	Nghị định số 116/2016/NĐ-CP ng&agrave;y 18 th&aacute;ng 7 năm 2016 của Ch&iacute;nh phủ Quy định ch&iacute;nh s&aacute;ch hỗ trợ học sinh b&aacute;n tr&uacute;, trường phổ th&ocirc;ng d&acirc;n tộc b&aacute;n tr&uacute; v&agrave; học sinh trung học phổ th&ocirc;ng ở x&atilde;, th&ocirc;n đặc biệt kh&oacute; khăn.</p> ","","2020-02-26 13:49:11.021+07","0","","268248","","182057151199000051153183077151000049083087105083000149013049083000083127000151147141000053127085000177133085000083117049000149085105083000151147153105081000083117049000143083125000151083119105081000101015000105081165135085000051035105000151129049000100085105083","","1","f"
"120187","Giải thể trường trung học phổ thông chuyên","41990","TT033_GDDT","2","14","20 ngày làm việc, kể từ ngày nhận đủ hồ sơ hợp lệ.","Cá nhân, cơ quan, tổ chức","Trực tiếp tại cơ quan, qua mạng Internet hoặc qua đường bưu điện (Mức 3)","Quyết định","01","<p> 	a) Sở Gi&aacute;o dục v&agrave; Đ&agrave;o tạo (đối với trường trung học phổ th&ocirc;ng chuy&ecirc;n c&ocirc;ng lập); tổ chức, c&aacute; nh&acirc;n th&agrave;nh lập trường (đối với trường trung học phổ th&ocirc;ng chuy&ecirc;n tư thục) x&acirc;y dựng phương &aacute;n giải thể trường, tr&igrave;nh Chủ tịch Ủy ban nh&acirc;n d&acirc;n cấp tỉnh ra quyết định giải thể trường. Quyết định giải thể trường phải x&aacute;c định r&otilde; l&yacute; do giải thể; c&aacute;c biện ph&aacute;p bảo đảm quyền, lợi &iacute;ch hợp ph&aacute;p của học sinh, gi&aacute;o vi&ecirc;n, c&aacute;n bộ quản l&yacute; v&agrave; nh&acirc;n vi&ecirc;n v&agrave; phải được c&ocirc;ng bố c&ocirc;ng khai tr&ecirc;n c&aacute;c phương tiện th&ocirc;ng tin đại ch&uacute;ng;Trung t&acirc;m phục vụ h&agrave;nh ch&iacute;nh c&ocirc;ng tỉnh S&oacute;c Trăng (số 19, đường Trần Hưng Đạo, phường 3, th&agrave;nh phố S&oacute;c Trăng);</p> <p> 	b) Sở Gi&aacute;o dục v&agrave; Đ&agrave;o tạo xem x&eacute;t đề nghị của tổ chức, c&aacute; nh&acirc;n th&agrave;nh lập trường; b&aacute;o c&aacute;o bằng văn bản đề nghị Chủ tịch Ủy ban nh&acirc;n d&acirc;n cấp tỉnh ra quyết định giải thể nh&agrave; trường;</p> <p> 	c) Trong v&ograve;ng 20 ng&agrave;y l&agrave;m việc, kể từ ng&agrave;y nhận đủ hồ sơ hợp lệ, Chủ tịch Ủy ban nh&acirc;n d&acirc;n cấp tỉnh ra quyết định giải thể trường.</p> ","<p> 	Kh&ocirc;ng</p>","<p> 	Kh&ocirc;ng</p> ","4","<p> 	- Nghị định số&nbsp;<a href=""https://thuvienphapluat.vn/van-ban/dau-tu/nghi-dinh-46-2017-nd-cp-quy-dinh-dieu-kien-dau-tu-hoat-dong-trong-linh-vuc-giao-duc-336219.aspx"" target=""_blank"" title=""Nghị định 46/2017/NĐ-CP"">46/2017/NĐ-CP</a>&nbsp;ng&agrave;y 21 th&aacute;ng 4 năm 2017 của Ch&iacute;nh phủ quy định về điều kiện đầu tư v&agrave; hoạt động trong lĩnh vực gi&aacute;o dục.</p> <p> 	- Nghị định số&nbsp;<a href=""https://thuvienphapluat.vn/van-ban/thuong-mai/nghi-dinh-135-2018-nd-cp-sua-doi-nghi-dinh-46-2017-nd-cp-dau-tu-trong-linh-vuc-giao-duc-315730.aspx"" target=""_blank"" title=""Nghị định 135/2018/NĐ-CP"">135/2018/NĐ-CP</a>&nbsp;ng&agrave;y 04/10/2018 của Ch&iacute;nh phủ sửa đổi một số điều của Nghị định&nbsp;<a href=""https://thuvienphapluat.vn/van-ban/dau-tu/nghi-dinh-46-2017-nd-cp-quy-dinh-dieu-kien-dau-tu-hoat-dong-trong-linh-vuc-giao-duc-336219.aspx"" target=""_blank"" title=""Nghị định 46/2017/NĐ-CP"">46/2017/NĐ-CP</a>&nbsp;ng&agrave;y 21/4/2017 của Ch&iacute;nh phủ quy định về điều kiện đầu tư v&agrave; hoạt động trong lĩnh vực gi&aacute;o dục.</p> ","","2020-02-26 13:49:14.222+07","0","","11799","","082085017085000151083073000151147165135105081000151147153105081000083117049000143083125000151083119105081000049083153183067105","","2","t"
