"tt_id","tt_ten","tt_id_dv","tt_ma","lv_id","dv_id","tt_thoihan_gq","dtth_ten","ctth_ten","kq_ten","tt_sobo_tphs","tt_trinhtu_th","tt_lephi","tt_yeucau_dk","tt_revision","tt_cancu_pl","tt_ghichu","ngaycapnhatcuoi","tt_stt","tt_ngung_sd","qt_id","vbpl_banhanhtt","tt_ten_kd","tt_link_lienket","ctth_id","sd_buuchinh"
"138286","Chỉnh sửa nội dung văn bằng, chứng chỉ","326","2.001914.000.00.00.H51","3","14","05 ngày làm việc, kể từ ngày nhận đủ hồ sơ theo quy định","Cá nhân","Thủ tục hành chính công mức độ 4","Quyết định chỉnh sửa và bản sao văn bằng","01","<p> 	Bước 1: Nộp hồ sơ tại Bộ phận một cửa thuộc Sở Gi&aacute;o dục v&agrave; Đ&agrave;o tạo tỉnh S&oacute;c Trăng, địa chỉ: 48 L&ecirc; Duẩn, Phường 3, Tp. S&oacute;c Trăng; ĐT: 0793. 616.042<br /> 	Bước 2: C&aacute;n bộ phụ tr&aacute;ch tại Bộ phận một cửa c&oacute; tr&aacute;ch nhiệm tiếp nhận, xem x&eacute;t v&agrave; kiểm tra giấy tờ minh chứng, để:<br /> 	- Nếu nội dung thủ tục h&agrave;nh ch&iacute;nh thuộc thẩm quyền của Sở Gi&aacute;o dục v&agrave; Đ&agrave;o tạo th&igrave; ghi nội dung y&ecirc;u cầu v&agrave;o sổ tiếp nhận hồ sơ, viết phiếu hẹn.<br /> 	- Nếu nội dung của thủ tục h&agrave;nh ch&iacute;nh kh&ocirc;ng thuộc thẩm quyền của Sở Gi&aacute;o dục v&agrave; Đ&agrave;o tạo th&igrave; hướng dẫn đương sự đến đ&uacute;ng cơ quan c&oacute; thẩm quyền để được xem x&eacute;t, giải quyết.<br /> 	Bước 3. Người được ph&acirc;n c&ocirc;ng giải quyết y&ecirc;u cầu của thủ tục h&agrave;nh ch&iacute;nh căn cứ Sổ gốc cấp ph&aacute;t văn bằng, chứng chỉ lưu trữ tại Sở GD&amp;ĐT v&agrave; c&aacute;c giấy tờ minh chứng:<br /> 	- Nếu y&ecirc;u cầu của hồ sơ l&agrave; ph&ugrave; hợp th&igrave; đề nghị Gi&aacute;m đốc Sở Gi&aacute;o dục v&agrave; Đ&agrave;o tạo ra Quyết định chỉnh sửa v&agrave; cấp bản sao văn bằng theo mẫu của Bộ Gi&aacute;o dục v&agrave; Đ&agrave;o tạo.<br /> 	- Nếu y&ecirc;u cầu của hồ sơ l&agrave; kh&ocirc;ng ph&ugrave; hợp th&igrave; chuyển to&agrave;n bộ hồ sơ về Bộ phận tiếp nhận v&agrave; ho&agrave;n trả kết quả c&ugrave;ng với văn bản n&ecirc;u r&otilde; nguy&ecirc;n nh&acirc;n.</p> ","<p> 	Kh&ocirc;ng</p>","<p> 	Người được cấp văn bằng, chứng chỉ c&oacute; quyền y&ecirc;u cầu chỉnh sửa nội dung ghi tr&ecirc;n văn bằng, chứng chỉ trong trường hợp sau khi được cấp văn bằng, chứng chỉ, người học được cơ quan c&oacute; thẩm quyền quyết định hoặc x&aacute;c nhận việc thay đổi hoặc cải ch&iacute;nh hộ tịch, x&aacute;c định lại d&acirc;n tộc, x&aacute;c định lại giới t&iacute;nh, bổ sung hộ tịch, điều chỉnh hộ tịch, đăng k&yacute; khai sinh qu&aacute; hạn, đăng k&yacute; lại việc sinh theo quy định của ph&aacute;p luật.</p> ","38","<p> 	Th&ocirc;ng tư số 19/2015/TT-BGDĐT ng&agrave;y 08/9/2015 của Bộ trưởng Bộ Gi&aacute;o dục v&agrave; Đ&agrave;o tạo ban h&agrave;nh Quy chế quản l&yacute; bằng tốt nghiệp trung học cơ sở, bằng tốt nghiệp trung học phổ th&ocirc;ng, văn bằng gi&aacute;o dục đại học v&agrave; chứng chỉ của hệ thống gi&aacute;o dục quốc d&acirc;n.</p> ","","2020-05-20 15:42:35.659+07","0","","11816","","050083091105083000149171011000105129085000051153105081000177023105000047027105081199000049083167105081000049083091","","3",""
"157000","Cấp bản sao văn bằng, chứng chỉ từ sổ gốc","309","1.005092.000.00.00.H51","3","14","Trong ngày hoặc tối đa không quá 02 ngày","Cá nhân","Thủ tục hành chính công mức độ 4","Bản sao văn bằng chứng chỉ","01","<p> 	<span style=""font-family: Tahoma; font-size: small;"">Bước 1: Nộp hồ sơ tại Bộ phận một cửa thuộc Sở Gi&aacute;o dục v&agrave; Đ&agrave;o tạo tỉnh S&oacute;c Trăng, địa chỉ: 48 L&ecirc; Duẩn, Phường 3, Tp. S&oacute;c Trăng; ĐT: 0793. 616.042&nbsp;</span></p> <div> 	<span style=""font-family: Tahoma; font-size: small;"">Bước 2:&nbsp;C&aacute;n bộ phụ tr&aacute;ch tại Bộ phận một cửa c&oacute; tr&aacute;ch nhiệm tiếp nhận, xem x&eacute;t v&agrave; kiểm tra giấy tờ minh chứng, để:</span></div> <br /> <p> 	<span style=""font-family: Tahoma; font-size: small;"">- Nếu nội dung thủ tục h&agrave;nh ch&iacute;nh thuộc thẩm quyền của Sở Gi&aacute;o dục v&agrave; Đ&agrave;o tạo th&igrave; ghi nội dung y&ecirc;u cầu v&agrave;o sổ tiếp nhận hồ sơ, viết phiếu hẹn.<br /> 	- Nếu nội dung của thủ tục h&agrave;nh ch&iacute;nh kh&ocirc;ng thuộc thẩm quyền của Sở Gi&aacute;o dục v&agrave; Đ&agrave;o tạo th&igrave; hướng dẫn đương sự đến đ&uacute;ng cơ quan c&oacute; thẩm quyền để được xem x&eacute;t, giải quyết.<br /> 	Bước 3. Người được ph&acirc;n c&ocirc;ng giải quyết y&ecirc;u cầu của thủ tục h&agrave;nh ch&iacute;nh căn cứ Sổ gốc cấp ph&aacute;t văn bằng, chứng chỉ lưu trữ tại Sở GD&amp;ĐT v&agrave; c&aacute;c giấy tờ minh chứng:<br /> 	- Nếu y&ecirc;u cầu của hồ sơ l&agrave; ph&ugrave; hợp th&igrave; đề nghị Gi&aacute;m đốc Sở Gi&aacute;o dục v&agrave; Đ&agrave;o tạo cấp bản sao văn bằng theo mẫu của Bộ Gi&aacute;o dục v&agrave; Đ&agrave;o tạo.</span></p> <div> 	<span style=""font-family: Tahoma; font-size: small;"">- Nếu&nbsp;</span><span style=""font-family: Tahoma; font-size: small;"">y&ecirc;u cầu của hồ sơ l&agrave; kh&ocirc;ng ph&ugrave; hợp</span><span style=""font-family: Tahoma; font-size: small;"">&nbsp;th&igrave; chuyển to&agrave;n bộ hồ sơ về Bộ phận tiếp nhận v&agrave; ho&agrave;n trả kết quả c&ugrave;ng với văn bản n&ecirc;u r&otilde; nguy&ecirc;n nh&acirc;n.</span></div> ","<p> 	Kh&ocirc;ng</p>","<p> 	Những người sau đ&acirc;y c&oacute; quyền y&ecirc;u cầu cấp bản sao văn bằng, chứng chỉ từ sổ gốc:<br /> 	+ Người được cấp bản ch&iacute;nh văn bằng, chứng chỉ;<br /> 	+ Người đại diện hợp ph&aacute;p, người được ủy quyền hợp ph&aacute;p của người được cấp bản ch&iacute;nh văn bằng, chứng chỉ;<br /> 	+ Cha, mẹ, con, vợ, chồng, anh, chị, em ruột, người thừa kế của người được cấp bản ch&iacute;nh văn bằng, chứng chỉ trong trường hợp người được cấp bản ch&iacute;nh văn bằng, chứng chỉ đ&atilde; chết.</p> ","45","<p> 	Th&ocirc;ng tư số 19/2015/TT-BGDĐT ng&agrave;y 08/9/2015 của Bộ trưởng Bộ Gi&aacute;o dục v&agrave; Đ&agrave;o tạo ban h&agrave;nh Quy chế quản l&yacute; bằng tốt nghiệp trung học cơ sở, bằng tốt nghiệp trung học phổ th&ocirc;ng, văn bằng gi&aacute;o dục đại học v&agrave; chứng chỉ của hệ thống gi&aacute;o dục quốc d&acirc;n.</p> ","","2020-07-05 14:00:06.288+07","0","","11764","","050037143000047017105000149011107000177023105000047027105081199000049083167105081000049083091000151169000149125000081121049","","3",""
"126006","Công nhận trường tiểu học đạt chuẩn quốc gia","42002","1.000280.000.00.00.H51","2","14","120 ngày làm việc","Tổ chức","Trực tiếp tại cơ quan, qua mạng Internet hoặc qua đường bưu điện (Mức 3)","Bằng công nhận","01","<p> 	<strong>- Trường tiểu học gửi hồ sơ đến Bộ phận tiếp nhận v&agrave; trả kết quả&nbsp;</strong>thuộc Văn ph&ograve;ng HĐND v&agrave; UBND cấp huyện.</p> <p> 	- Trường tiểu học gửi hồ sơ đến Bộ phận tiếp nhận v&agrave; trả kết quả thuộc Văn ph&ograve;ng HĐND v&agrave; UBND cấp huyện.</p> <p> 	- Ph&ograve;ng Gi&aacute;o dục v&agrave; Đ&agrave;o tạo c&oacute; tr&aacute;ch nhiệm:</p> <p> 	&nbsp;+ Tiếp nhận, kiểm tra hồ sơ đăng k&yacute; đ&aacute;nh gi&aacute; ngo&agrave;i của trường tiểu học tr&ecirc;n địa b&agrave;n thuộc phạm vi quản l&yacute; v&agrave; th&ocirc;ng tin cho trường tiểu học biết hồ sơ được chấp nhận hoặc y&ecirc;u cầu tiếp tục ho&agrave;n thiện.</p> <p> 	&nbsp;+ Gửi hồ sơ đăng k&yacute; đ&aacute;nh gi&aacute; ngo&agrave;i của trường tiểu học được chấp nhận đến Trung t&acirc;m Phục vụ h&agrave;nh ch&iacute;nh c&ocirc;ng tỉnh S&oacute;c Trăng(số 19, đường Trần Hưng Đạo, phường 3, th&agrave;nh phố S&oacute;c Trăng).</p> <p> 	Cán b&ocirc;̣ l&agrave;m việc tại Trung t&acirc;m Phục vụ h&agrave;nh ch&iacute;nh c&ocirc;ng tỉnh S&oacute;c Trăngti&ecirc;́p nh&acirc;̣n h&ocirc;̀ sơ ki&ecirc;̉m tra đ&acirc;̀u mục h&ocirc;̀ sơ</p> <p> 	- N&ecirc;́u hợp l&ecirc;̣, vào s&ocirc;̉ theo dõi h&ocirc;̀ sơ; vi&ecirc;́t gi&acirc;́y ti&ecirc;́p nh&acirc;̣n h&ocirc;̀ sơ và hẹn trả k&ecirc;́t quả trao cho người n&ocirc;̣p h&ocirc;̀ sơ; chuy&ecirc;̉n h&ocirc;̀ sơ kèm theo phi&ecirc;́u ki&ecirc;̉m soát quá trình giải quy&ecirc;́t h&ocirc;̀ sơ đ&ecirc;́n cán b&ocirc;̣ chuy&ecirc;n xử lý</p> <p> 	- N&ecirc;́u h&ocirc;̀ sơ kh&ocirc;ng hợp l&ecirc;̣, hướng d&acirc;̃n người n&ocirc;̣p h&ocirc;̀ sơ hoàn thi&ecirc;̣n bằng phi&ecirc;́u hướng d&acirc;̃n hoàn thi&ecirc;̣n h&ocirc;̀ sơ.</p> <p> 	+ Tiếp nhận, kiểm tra hồ sơ đăng k&yacute; đ&aacute;nh gi&aacute; ngo&agrave;i từ c&aacute;c Ph&ograve;ng Gi&aacute;o dục v&agrave; đ&agrave;o tạo, th&ocirc;ng tin cho Ph&ograve;ng Gi&aacute;o dục v&agrave; đ&agrave;o tạo biết hồ sơ được chấp nhận để đ&aacute;nh gi&aacute; ngo&agrave;i hoặc y&ecirc;u cầu tiếp tục ho&agrave;n thiện.</p> <p> 	+ Tiếp nhận, kiểm tra hồ sơ đăng k&yacute; đ&aacute;nh gi&aacute; ngo&agrave;i từ c&aacute;c trường tiểu học tr&ecirc;n địa b&agrave;n thuộc phạm vi quản l&yacute;; th&ocirc;ng tin cho trường tiểu học biết hồ sơ được chấp nhận để đ&aacute;nh gi&aacute; ngo&agrave;i hoặc y&ecirc;u cầu tiếp tục ho&agrave;n thiện.</p> <p> 	+ Tr&igrave;nh Gi&aacute;m đốc th&agrave;nh lập đo&agrave;n đ&aacute;nh gi&aacute; ngo&agrave;i v&agrave; triển khai c&aacute;c bước trong quy tr&igrave;nh đ&aacute;nh gi&aacute; ngo&agrave;i trong thời hạn 03 th&aacute;ng kể từ ng&agrave;y th&ocirc;ng tin cho Ph&ograve;ng Gi&aacute;o dục v&agrave; Đ&agrave;o tạo hoặc trường tiểu học biết hồ sơ đ&atilde; được chấp nhận để đ&aacute;nh gi&aacute; ngo&agrave;i.</p> <p> 	- Quy tr&igrave;nh đ&aacute;nh gi&aacute; ngo&agrave;i trường tiểu học gồm c&aacute;c bước sau:</p> <p> 	+Nghi&ecirc;n cứu hồ sơ đ&aacute;nh gi&aacute;.</p> <p> 	+ Khảo s&aacute;t sơ bộ tại trường tiểu học.</p> <p> 	+ Khảo s&aacute;t ch&iacute;nh thức tại trường tiểu học.</p> <p> 	+ Dự thảo b&aacute;o c&aacute;o đ&aacute;nh gi&aacute; ngo&agrave;i</p> <p> 	+ Lấy &yacute; kiến phản hồi của trường tiểu học về dựthảo b&aacute;o c&aacute;o đ&aacute;nh gi&aacute; ngo&agrave;i.</p> <p> 	&nbsp;&nbsp;&nbsp;&nbsp;&nbsp;&nbsp;&nbsp; + Ho&agrave;n thiện b&aacute;o c&aacute;o đ&aacute;nh gi&aacute; ngo&agrave;i</p> <p> 	- Sau khi thống nhất trong đo&agrave;n đ&aacute;nh gi&aacute; ngo&agrave;i, đo&agrave;n đ&aacute;nh gi&aacute; ngo&agrave;i gửi dự thảo b&aacute;o c&aacute;o đ&aacute;nh gi&aacute; ngo&agrave;i cho trường tiểu học để lấy &yacute; kiến phản hồi.</p> <p> 	Trường tiểu họcc&oacute; tr&aacute;ch nhiệm gửi c&ocirc;ng văn cho đo&agrave;n đ&aacute;nh gi&aacute; ngo&agrave;i n&ecirc;u r&otilde; &yacute; kiến nhất tr&iacute; hoặc kh&ocirc;ng nhất tr&iacute; với bản dự thảo b&aacute;o c&aacute;o đ&aacute;nh gi&aacute; ngo&agrave;i. Trường hợp kh&ocirc;ng nhất tr&iacute; với dự thảo b&aacute;o c&aacute;o đ&aacute;nh gi&aacute; ngo&agrave;i phải n&ecirc;u r&otilde; l&yacute; do.</p> <p> 	Đo&agrave;n đ&aacute;nh gi&aacute; ngo&agrave;i th&ocirc;ng b&aacute;o bằng văn bản cho trường tiểu học biết những &yacute; kiến tiếp thu hoặc bảo lưu, trường hợp bảo lưu &yacute; kiến phải n&ecirc;u r&otilde; l&yacute; do.</p> <p> 	Tổng hợp hồ sơ đ&atilde; ho&agrave;n thiện, tr&igrave;nh l&atilde;nh đạo Sở xem x&eacute;t v&agrave; ph&ecirc; duyệt. Đồng thời kết quả kiểm định phải được c&ocirc;ng bố c&ocirc;ng khai tr&ecirc;n website của Sở GD&amp;ĐT</p> <p> 	Tiếp nhận kết quả, v&agrave;o sổ theo d&otilde;i bàn giao k&ecirc;́t quả v&ecirc;̀ Trung t&acirc;m Phục vụ h&agrave;nh ch&iacute;nh c&ocirc;ng tỉnh S&oacute;c Trăng</p> <p> 	Lưu h&ocirc;̀ sơ theo dõi</p> <p> 	Trả k&ecirc;́t quả cho c&ocirc;ng d&acirc;n theo quy định</p> <p> 	&nbsp;</p> <p> 	&nbsp;</p> ","<p> 	Kh&ocirc;ng</p>","<p> 	<strong>* </strong>Điều kiện c&ocirc;ng nhận trường tiểu học đạt chuẩn quốc gia:</p> <p> 	+ C&oacute; &iacute;t nhất một kho&aacute; học sinh đ&atilde; ho&agrave;n th&agrave;nh Chương tr&igrave;nh tiểu học;</p> <p> 	+ C&oacute; kết quả đ&aacute;nh gi&aacute; ngo&agrave;i đ&aacute;nh gi&aacute; đạt từ Mức 2 trở l&ecirc;n.</p> <p> 	* Mức độ c&ocirc;ng nhận:</p> <p> 	&nbsp;&nbsp;&nbsp;&nbsp;&nbsp;&nbsp;&nbsp;&nbsp;&nbsp; -Mức độ 1: Trường được đ&aacute;nh gi&aacute; đạt Mức 2;</p> <p> 	&nbsp;&nbsp;&nbsp;&nbsp;&nbsp;&nbsp;&nbsp;&nbsp;&nbsp; -Mức độ 2: Trường được đ&aacute;nh gi&aacute; đạt Mức 3 trở l&ecirc;n .</p> ","102","<p> 	Th&ocirc;ng tư số 17/2018/TT-BGDĐT ng&agrave;y 22 th&aacute;ng 8 năm 2018 của Bộ trưởng Bộ Gi&aacute;o dục v&agrave; Đ&agrave;o tạo ban h&agrave;nh quy định&nbsp; về kiểm định chất lượng v&agrave; c&ocirc;ng nhận đạt chuẩn quốc gia&nbsp; đối với trường tiểu học.</p> ","","2020-04-16 16:03:05.848+07","0","","268247","","050119105081000105083045105000151147165135105081000151085073153000083117049000053021151000049083153041105000145153121049000081085011","","2","t"
"135890","Chấm dứt hoạt động của cơ sở đào tạo, bồi dưỡng ngắn hạn có vốn đầu tư nước ngoài tại Việt Nam","42063","1.001493.000.00.00.H51","2","14","30 ngày","Cá nhân","Thủ tục hành chính công mức độ 4","Quyết định; Văn bản trả lời","","<p> 	<strong>* Bước 1:</strong>Nh&agrave; đầu tư nộp hồ sơ đề nghị chấm dứt hoạt động của cơ sở đ&agrave;o tạo, bồi dưỡng ngắn hạn c&oacute; vốn đầu tư nước ngo&agrave;i tại Bộ phận tiếp nhận v&agrave; trả kết quả thuộc Sở Gi&aacute;o dục v&agrave; Đ&agrave;o tạo.</p> <p> 	<strong>* Bước 2:</strong>Trong thời hạn 05 ng&agrave;y l&agrave;m việc kể từ ng&agrave;y nhận hồ sơ, nếu hồ sơ kh&ocirc;ng đ&aacute;p ứng y&ecirc;u cầu quy định th&igrave; cơ quan tiếp nhận hồ sơ th&ocirc;ng b&aacute;o bằng văn bản gửi trực tiếp hoặc qua bưu điện hoặc thư điện tử cho nh&agrave; đầu tư.</p> <p> 	<strong>* Bước 3:</strong>Trong thời hạn 30 ng&agrave;y l&agrave;m việc kể từ ng&agrave;y nhận đủ hồ sơ, cơ quan tiếp nhận hồ sơ chủ tr&igrave; thẩm định, tr&igrave;nh c&aacute;c cấp c&oacute; thẩm quyền xem x&eacute;t, quyết định.</p> <p> 	Quyết định giải thể, chấm dứt hoạt động của cơ sở gi&aacute;o dục phải ghi r&otilde; l&yacute; do giải thể, chấm dứt hoạt động, c&aacute;c biện ph&aacute;p đảm bảo quyền hợp ph&aacute;p của người học, nh&agrave; gi&aacute;o, c&aacute;n bộ quản l&yacute; v&agrave; nh&acirc;n vi&ecirc;n phải được c&ocirc;ng bố c&ocirc;ng khai tr&ecirc;n phương tiện th&ocirc;ng tin đại ch&uacute;ng.</p> ","<p> 	Kh&ocirc;ng</p>","<p> 	Theo đề nghị của nh&agrave; đầu tư.</p> ","8","<p> 	Nghị định số 86/2018/NĐ-CP ng&agrave;y 6 th&aacute;ng 6 năm 2018 của Chính phủ quy định về hợp t&aacute;c, đầu tư của nước ngo&agrave;i trong lĩnh vực gi&aacute;o dục</p> ","","2020-04-19 14:00:07.615+07","0","","268303","","050083037103000051167151000083107021151000053129105081000049159011000049131000149137000053015107000151021107199000047123085000051165139105081000105081025105000083021105000049109000177121105000053039153000151165000105165133049000105081107015085000151021085000178085077151000106011103","","3",""
"135899","Giải thể trường phổ thông dân tộc nội trú","41993","1.005076.000.00.00.H51","2","14","20 ngày làm việc.","Cá nhân, tổ chức","Trực tiếp tại cơ quan, qua mạng Internet hoặc qua đường bưu điện (Mức 3)","Quyết định","01","<p> 	a) Sở Gi&aacute;o dục v&agrave; Đ&agrave;o tạo (đối với trường phổ th&ocirc;ng d&acirc;n tộc nội tr&uacute; c&ocirc;ng lập); tổ chức, c&aacute; nh&acirc;n th&agrave;nh lập trường (đối với trường phổ th&ocirc;ng d&acirc;n tộc nội tr&uacute; tư thục) x&acirc;y dựng phương &aacute;n giải thể trường, tr&igrave;nh Chủ tịch Ủy ban nh&acirc;n d&acirc;n cấp tỉnh ra quyết định giải thể trường. Quyết định giải thể trường phải x&aacute;c định r&otilde; l&yacute; do giải thể; c&aacute;c biện ph&aacute;p bảo đảm quyền, lợi &iacute;ch hợp ph&aacute;p của học sinh, gi&aacute;o vi&ecirc;n, c&aacute;n bộ quản l&yacute; v&agrave; nh&acirc;n vi&ecirc;n v&agrave; phải được c&ocirc;ng bố c&ocirc;ng khai tr&ecirc;n c&aacute;c phương tiện th&ocirc;ng tin đại ch&uacute;ng;Trung t&acirc;m phục vụ h&agrave;nh ch&iacute;nh c&ocirc;ng tỉnh S&oacute;c Trăng (số 19, đường Trần Hưng Đạo, phường 3, th&agrave;nh phố S&oacute;c Trăng);</p> <p> 	b) Sở Gi&aacute;o dục v&agrave; Đ&agrave;o tạo xem x&eacute;t đề nghị của tổ chức, c&aacute; nh&acirc;n th&agrave;nh lập trường; b&aacute;o c&aacute;o bằng văn bản đề nghị Chủ tịch Ủy ban nh&acirc;n d&acirc;n cấp tỉnh ra quyết định giải thể nh&agrave; trường;</p> <p> 	c) Trong v&ograve;ng 20 ng&agrave;y l&agrave;m việc, kể từ ng&agrave;y nhận đủ hồ sơ hợp lệ, Chủ tịch Ủy ban nh&acirc;n d&acirc;n cấp tỉnh ra quyết định giải thể&nbsp;trường.</p> ","<p> 	Kh&ocirc;ng</p>","<p> 	Kh&ocirc;ng</p> ","8","<p> 	- Nghị định số&nbsp;<a href=""https://thuvienphapluat.vn/van-ban/dau-tu/nghi-dinh-46-2017-nd-cp-quy-dinh-dieu-kien-dau-tu-hoat-dong-trong-linh-vuc-giao-duc-336219.aspx"" target=""_blank"" title=""Nghị định 46/2017/NĐ-CP"">46/2017/NĐ-CP</a>&nbsp;ng&agrave;y 21 th&aacute;ng 4 năm 2017 của Ch&iacute;nh phủ quy định về điều kiện đầu tư v&agrave; hoạt động trong lĩnh vực gi&aacute;o dục.</p> <p> 	- Nghị định số&nbsp;<a href=""https://thuvienphapluat.vn/van-ban/thuong-mai/nghi-dinh-135-2018-nd-cp-sua-doi-nghi-dinh-46-2017-nd-cp-dau-tu-trong-linh-vuc-giao-duc-315730.aspx"" target=""_blank"" title=""Nghị định 135/2018/NĐ-CP"">135/2018/NĐ-CP</a>&nbsp;ng&agrave;y 04/10/2018 của Ch&iacute;nh phủ sửa đổi một số điều của Nghị định&nbsp;<a href=""https://thuvienphapluat.vn/van-ban/dau-tu/nghi-dinh-46-2017-nd-cp-quy-dinh-dieu-kien-dau-tu-hoat-dong-trong-linh-vuc-giao-duc-336219.aspx"" target=""_blank"" title=""Nghị định 46/2017/NĐ-CP"">46/2017/NĐ-CP</a>&nbsp;ng&agrave;y 21/4/2017 của Ch&iacute;nh phủ quy định về điều kiện đầu tư v&agrave; hoạt động trong lĩnh vực gi&aacute;o dục.</p> ","","2020-04-19 14:00:08.264+07","0","","11799","","082085017085000151083073000151147165135105081000143083125000151083119105081000051035105000151129049000105129085000151147155","","2",""
"135897","Giải thể trung tâm ngoại ngữ, tin học","41996","1.005036.000.00.00.H51","2","14","Không quy định","Cá nhân, tổ chức","Trực tiếp tại cơ quan, qua mạng Internet hoặc qua đường bưu điện (Mức 3)","Quyết định","01","<p> 	a) Người c&oacute; thẩm quyền quyết định th&agrave;nh lập trung t&acirc;m ngoại ngữ, tin học tổ chức đo&agrave;n kiểm tra đ&aacute;nh gi&aacute; t&igrave;nh trạng thực tế của trung t&acirc;m, đề xuất phương &aacute;n xử l&yacute; hoặc xem x&eacute;t phương &aacute;n xử l&yacute; do tổ chức, c&aacute; nh&acirc;n th&agrave;nh lập trung t&acirc;m kiến nghị, đề xuất, lập b&aacute;o c&aacute;o kết quả kiểm tra;Trung t&acirc;m phục vụ h&agrave;nh ch&iacute;nh c&ocirc;ng tỉnh S&oacute;c Trăng (số 19, đường Trần Hưng Đạo, phường 3, th&agrave;nh phố S&oacute;c Trăng);</p> <p> 	b) Căn cứ kết quả kiểm tra, người c&oacute; thẩm quyền quyết định th&agrave;nh lập trung t&acirc;m ra quyết định giải thể trung t&acirc;m ngoại ngữ, tin học. Trong quyết định giải thể phải x&aacute;c định r&otilde; l&yacute; do giải thể, c&aacute;c biện ph&aacute;p bảo đảm quyền, lợi &iacute;ch hợp ph&aacute;p của học vi&ecirc;n, gi&aacute;o vi&ecirc;n, c&aacute;n bộ quản l&yacute;, nh&acirc;n vi&ecirc;n v&agrave; phải được c&ocirc;ng bố c&ocirc;ng khai tr&ecirc;n c&aacute;c phương tiện th&ocirc;ng tin đại ch&uacute;ng.</p> ","<p> 	Kh&ocirc;ng</p>","<p> 	Kh&ocirc;ng</p> ","9","<p> 	- Nghị định số&nbsp;<a href=""https://thuvienphapluat.vn/van-ban/dau-tu/nghi-dinh-46-2017-nd-cp-quy-dinh-dieu-kien-dau-tu-hoat-dong-trong-linh-vuc-giao-duc-336219.aspx"" target=""_blank"" title=""Nghị định 46/2017/NĐ-CP"">46/2017/NĐ-CP</a>&nbsp;ng&agrave;y 21/4/2017 của Ch&iacute;nh phủ quy định về điều kiện đầu tư v&agrave; hoạt động trong lĩnh vực gi&aacute;o dục;</p> <p> 	- Nghị định số&nbsp;<a href=""https://thuvienphapluat.vn/van-ban/thuong-mai/nghi-dinh-135-2018-nd-cp-sua-doi-nghi-dinh-46-2017-nd-cp-dau-tu-trong-linh-vuc-giao-duc-315730.aspx"" target=""_blank"" title=""Nghị định 135/2018/NĐ-CP"">135/2018/NĐ-CP</a>&nbsp;ng&agrave;y 04/10/2018 của Ch&iacute;nh phủ sửa đổi một số điều của Nghị định&nbsp;<a href=""https://thuvienphapluat.vn/van-ban/dau-tu/nghi-dinh-46-2017-nd-cp-quy-dinh-dieu-kien-dau-tu-hoat-dong-trong-linh-vuc-giao-duc-336219.aspx"" target=""_blank"" title=""Nghị định 46/2017/NĐ-CP"">46/2017/NĐ-CP</a>&nbsp;ng&agrave;y 21/4/2017 của Ch&iacute;nh phủ quy định về điều kiện đầu tư v&agrave; hoạt động trong lĩnh vực gi&aacute;o dục.</p> ","","2020-04-19 14:00:08.195+07","0","","268245","","082085017085000151083073000151147153105081000151035103000105081107021085000105081173199000151085105000083117049","","2",""
